<?xml version='1.0' encoding='UTF-8'?>
<!DOCTYPE family_definitions SYSTEM "family_definitions.dtd">
<family_definitions version="1.0">
  <!-- 
    formaldehyde
  -->
  <family_definition code="0700">
    <formula>'C=O'1 H2</formula>
    <unsaturations>0</unsaturations>
    <substructures>
      <substructure substructure_code="KETONE" number="1">
        <atoms>
          <atom type="O"/>
          <atom type="C"/>
          <atom type="H"/>
          <atom type="H"/>
        </atoms>
      </substructure>
    </substructures>
  </family_definition>
  <!-- 
    saturated C2-C10 aldehyde - 1 group
  -->
  <family_definition code="0701">
    <formula>C[0-8] 'CC(=O)H'1 H[0-22]</formula>
    <unsaturations>0</unsaturations>
    <substructures>
      <substructure substructure_code="KETONE" number="1">
        <atoms>
          <atom type="O"/>
          <atom type="C"/>
          <atom type="C"/>
          <atom type="H"/>
        </atoms>
      </substructure>
    </substructures>
  </family_definition>
  <!-- 
    saturated C2-C10 aldehyde - 2 groups
  -->
  <family_definition code="0702">
    <formula>C[0-8] 'C(H)=O'2 H[0-22]</formula>
    <unsaturations>0</unsaturations>
    <substructures>
      <substructure substructure_code="KETONE" number="2">
        <atoms>
          <atom type="O"/>
          <atom type="C"/>
          <atom type="C"/>
          <atom type="H"/>
        </atoms>
      </substructure>
    </substructures>
  </family_definition>
  <!-- 
    saturated C2-C10 aldehyde - 3 groups
  -->
  <family_definition code="0703">
    <formula>C[0-7] 'C(H)=O'3 H[0-22]</formula>
    <unsaturations>0</unsaturations>
    <substructures>
      <substructure substructure_code="KETONE" number="3">
        <atoms>
          <atom type="O"/>
          <atom type="C"/>
          <atom type="C"/>
          <atom type="H"/>
        </atoms>
      </substructure>
    </substructures>
  </family_definition>
  <!-- 
    saturated C2-C10 aldehyde - 4 groups
  -->
  <family_definition code="0704">
    <formula>C[0-6] 'C(H)=O'4 H[0-22]</formula>
    <unsaturations>0</unsaturations>
    <substructures>
      <substructure substructure_code="KETONE" number="4">
        <atoms>
          <atom type="O"/>
          <atom type="C"/>
          <atom type="C"/>
          <atom type="H"/>
        </atoms>
      </substructure>
    </substructures>
  </family_definition>
</family_definitions>
