<?xml version='1.0' encoding='UTF-8'?>
<!DOCTYPE family_definitions SYSTEM "family_definitions.dtd">
<family_definitions version="1.0">
  <!-- 
    C1-C10 1-ester family
  -->
  <family_definition code="0800">
    <formula>C[1-9] 'OC(=O)H'1 H[0-22]</formula>
    <unsaturations>0</unsaturations>
    <substructures>
      <substructure substructure_code="ESTER" number="1">
        <atoms>
          <atom type="O"/>
          <atom type="C"/>
          <atom type="O"/>
          <atom type="C"/>
          <atom type="H"/>
        </atoms>
      </substructure>
    </substructures>
  </family_definition>
  <!-- 
    C1-C10 1-ester group (except methanoate)
  -->
  <family_definition code="0801">
    <formula>C[0-9] 'CH0=O'1 {OH0}1 H[0-22]</formula>
    <unsaturations>0</unsaturations>
    <substructures>
      <substructure substructure_code="ESTER" number="1">
        <atoms>
          <atom type="O"/>
          <atom type="C"/>
          <atom type="O"/>
          <atom type="C"/>
          <atom type="C"/>
        </atoms>
      </substructure>
    </substructures>
  </family_definition>
  <!-- 
    C1-C10 2-ester groups
  -->
  <family_definition code="0802">
    <formula>C[0-8] 'OC(=O)H'2 H[0-22]</formula>
    <unsaturations>0</unsaturations>
    <substructures>
      <substructure substructure_code="ESTER" number="2">
        <atoms>
          <atom type="O"/>
          <atom type="C"/>
          <atom type="O"/>
          <atom type="C"/>
          <atom type="H"/>
        </atoms>
      </substructure>
    </substructures>
  </family_definition>
  <!-- 
    C1-C10 2-ester group (except methanoate)
  -->
  <family_definition code="0803">
    <formula>C[0-8] 'CH0=O'2 {OH0}2 H[0-22]</formula>
    <unsaturations>0</unsaturations>
    <substructures>
      <substructure substructure_code="ESTER" number="2">
        <atoms>
          <atom type="O"/>
          <atom type="C"/>
          <atom type="O"/>
          <atom type="C"/>
          <atom type="C"/>
        </atoms>
      </substructure>
    </substructures>
  </family_definition>
  <!-- 
    C1-C10 3-ester groups
  -->
  <family_definition code="0804">
    <formula>C[0-7]{CH1}3H[0-22]{OH0}6</formula>
    <unsaturations>3</unsaturations>
    <substructures>
      <substructure substructure_code="ESTER" number="3">
        <atoms>
          <atom type="O"/>
          <atom type="C"/>
          <atom type="O"/>
          <atom type="C"/>
          <atom type="H"/>
        </atoms>
      </substructure>
    </substructures>
  </family_definition>
  <!-- 
    C1-C10 3-ester groups (except methanoate)
  -->
  <family_definition code="0805">
    <formula>C[0-7] 'CH0=O'3 {OH0}3 H[0-22]</formula>
    <unsaturations>0</unsaturations>
    <substructures>
      <substructure substructure_code="ESTER" number="3">
        <atoms>
          <atom type="O"/>
          <atom type="C"/>
          <atom type="O"/>
          <atom type="C"/>
          <atom type="C"/>
        </atoms>
      </substructure>
    </substructures>
  </family_definition>
  <!-- 
    C1-C10 4-ester groups
  -->
  <family_definition code="0806">
    <formula> C[0-6] 'OC(=O)H'4 H[0-22]</formula>
    <unsaturations>0</unsaturations>
    <substructures>
      <substructure substructure_code="ESTER" number="4">
        <atoms>
          <atom type="O"/>
          <atom type="C"/>
          <atom type="O"/>
          <atom type="C"/>
          <atom type="H"/>
        </atoms>
      </substructure>
    </substructures>
  </family_definition>
  <!-- 
    C1-C10 4-ester groups (except methanoate)
  -->
  <family_definition code="0807">
    <formula>C[0-6] 'CH0=O'4 {OH0}4 H[0-22]</formula>
    <unsaturations>0</unsaturations>
    <substructures>
      <substructure substructure_code="ESTER" number="4">
        <atoms>
          <atom type="O"/>
          <atom type="C"/>
          <atom type="O"/>
          <atom type="C"/>
          <atom type="C"/>
        </atoms>
      </substructure>
    </substructures>
  </family_definition>
</family_definitions>
