<?xml version='1.0' encoding='UTF-8'?>
<!DOCTYPE family_definitions SYSTEM "family_definitions.dtd">
<family_definitions version="1.0">
  <!-- 
    formic acid family
  -->
  <family_definition code="0900">
    <formula>'C(=O)OH'1 H*</formula>
    <unsaturations>0</unsaturations>
    <substructures>
      <substructure substructure_code="ESTER" number="1">
        <atoms>
          <atom type="O"/>
          <atom type="C"/>
          <atom type="O"/>
          <atom type="H"/>
          <atom type="H"/>
        </atoms>
      </substructure>
    </substructures>
  </family_definition>
  <!-- 
    carboxylic acid family
  -->
  <family_definition code="0901">
    <formula>C[1-9] 'C(=O)OH'1 H*</formula>
    <unsaturations>0</unsaturations>
    <substructures>
      <substructure substructure_code="ESTER" number="1">
        <atoms>
          <atom type="O"/>
          <atom type="C"/>
          <atom type="O"/>
          <atom type="H"/>
          <atom type="C"/>
        </atoms>
      </substructure>
    </substructures>
  </family_definition>
  <!-- 
    carboxylic acid family - 2 groups
  -->
  <family_definition code="0902">
    <formula>C[0-8] 'C(=O)OH'2 H*</formula>
    <unsaturations>0</unsaturations>
    <substructures>
      <substructure substructure_code="ESTER" number="2">
        <atoms>
          <atom type="O"/>
          <atom type="C"/>
          <atom type="O"/>
          <atom type="H"/>
          <atom type="C"/>
        </atoms>
      </substructure>
    </substructures>
  </family_definition>
  <!-- 
    carboxylic acid family - 3 groups
  -->
  <family_definition code="0903">
    <formula>C[0-7] 'C(=O)OH'3 H*</formula>
    <unsaturations>0</unsaturations>
    <substructures>
      <substructure substructure_code="ESTER" number="3">
        <atoms>
          <atom type="O"/>
          <atom type="C"/>
          <atom type="O"/>
          <atom type="H"/>
          <atom type="C"/>
        </atoms>
      </substructure>
    </substructures>
  </family_definition>
  <!-- 
    carboxylic acid family - 3 groups
  -->
  <family_definition code="0904">
    <formula>C[0-6] 'C(=O)OH'4 H*</formula>
    <unsaturations>0</unsaturations>
    <substructures>
      <substructure substructure_code="ESTER" number="4">
        <atoms>
          <atom type="O"/>
          <atom type="C"/>
          <atom type="O"/>
          <atom type="H"/>
          <atom type="C"/>
        </atoms>
      </substructure>
    </substructures>
  </family_definition>
</family_definitions>

