<?xml version='1.0' encoding='UTF-8'?>
<!DOCTYPE family_definitions SYSTEM "family_definitions.dtd">
<family_definitions version="1.0">
  <!-- 
    saturated C1-C10 with one ether group
  -->
  <family_definition code="0500">
    <formula>C[1-10] {OH0}1 H[1-22]</formula>
    <unsaturations>0</unsaturations>
    <substructures>
      <substructure substructure_code="ETHER" number="1">
        <atoms>
          <atom type="C"/>
          <atom type="O"/>
          <atom type="C"/>
        </atoms>
      </substructure>
    </substructures>
  </family_definition>
  <!-- 
    saturated C1-C10 with two ether groups
  -->
  <family_definition code="0501">
    <formula>C[1-10] {OH0}2 H[1-22]</formula>
    <unsaturations>0</unsaturations>
    <substructures>
      <substructure substructure_code="ETHER" number="2">
        <atoms>
          <atom type="C"/>
          <atom type="O"/>
          <atom type="C"/>
        </atoms>
      </substructure>
    </substructures>
  </family_definition>
  <!-- 
    saturated C1-C10 with three ether groups
  -->
  <family_definition code="0502">
    <formula>C[1-10] {OH0}3 H[1-22]</formula>
    <unsaturations>0</unsaturations>
    <substructures>
      <substructure substructure_code="ETHER" number="3">
        <atoms>
          <atom type="C"/>
          <atom type="O"/>
          <atom type="C"/>
        </atoms>
      </substructure>
    </substructures>
  </family_definition>
  <!-- 
    saturated C1-C10 with four ether groups
  -->
  <family_definition code="0503">
    <formula>C[1-10] {OH0}4 H[1-22]</formula>
    <unsaturations>0</unsaturations>
    <substructures>
      <substructure substructure_code="ETHER" number="4">
        <atoms>
          <atom type="C"/>
          <atom type="O"/>
          <atom type="C"/>
        </atoms>
      </substructure>
    </substructures>
  </family_definition>
</family_definitions>
