<?xml version='1.0' encoding='UTF-8'?>
<!DOCTYPE family_definitions SYSTEM "family_definitions.dtd">
<family_definitions version="1.0">
  <!-- 
    saturated C1-C10 with one amine group
  -->
  <family_definition code="1000">
    <formula>C[1-10] N1 H[1-40]</formula>
    <unsaturations>0</unsaturations>
    <substructures>
      <substructure substructure_code="TERNARY" amount="1">
        <atoms>
          <atom type="N"/>
          <atom type="C"/>
          <atom type="CorH"/>
          <atom type="CorH"/>
        </atoms>
      </substructure>
    </substructures>
  </family_definition>
  <!-- 
    saturated C1-C10 with one primary amine group
  -->
  <family_definition code="1001">
    <formula>C[1-10] N1 H[1-40]</formula>
    <unsaturations>0</unsaturations>
    <substructures>
      <substructure substructure_code="TERNARY" amount="1">
        <atoms>
          <atom type="N"/>
          <atom type="C"/>
          <atom type="H"/>
          <atom type="H"/>
        </atoms>
      </substructure>
    </substructures>
  </family_definition>
  <!-- 
    saturated C1-C10 with one secondary amine group
  -->
  <family_definition code="1002">
    <formula>C[1-10] N1 H[1-40]</formula>
    <unsaturations>0</unsaturations>
    <substructures>
      <substructure substructure_code="TERNARY" amount="1">
        <atoms>
          <atom type="N"/>
          <atom type="C"/>
          <atom type="C"/>
          <atom type="H"/>
        </atoms>
      </substructure>
    </substructures>
  </family_definition>
  <!-- 
    saturated C1-C10 with one tertiary amine group
  -->
  <family_definition code="1003">
    <formula>C[1-10] N1 H[1-40]</formula>
    <unsaturations>0</unsaturations>
    <substructures>
      <substructure substructure_code="TERNARY" amount="1">
        <atoms>
          <atom type="N"/>
          <atom type="C"/>
          <atom type="C"/>
          <atom type="C"/>
        </atoms>
      </substructure>
    </substructures>
  </family_definition>
  <!-- 
    saturated C1-C10 with two amine group
  -->
  <family_definition code="1004">
    <formula>C[1-10] N2 H[1-40]</formula>
    <unsaturations>0</unsaturations>
    <substructures>
      <substructure substructure_code="TERNARY" amount="2">
        <atoms>
          <atom type="N"/>
          <atom type="C"/>
          <atom type="CorH"/>
          <atom type="CorH"/>
        </atoms>
      </substructure>
    </substructures>
  </family_definition>
  <!-- 
    saturated C1-C10 with three amine groups
  -->
  <family_definition code="1005">
    <formula>C[1-10] N3 H[1-40]</formula>
    <unsaturations>0</unsaturations>
    <substructures>
      <substructure substructure_code="TERNARY" amount="3">
        <atoms>
          <atom type="N"/>
          <atom type="C"/>
          <atom type="CorH"/>
          <atom type="CorH"/>
        </atoms>
      </substructure>
    </substructures>
  </family_definition>
</family_definitions>

