<?xml version='1.0' encoding='UTF-8'?>
<!DOCTYPE family_definitions SYSTEM "family_definitions.dtd">
<family_definitions version="1.0">
  <!-- 
    saturated C1-C10 with one alcohol group and 1 halogen
  -->
  <family_definition code="1100">
    <formula>C[1-6] H[1-22] {OH}1 Hal1</formula>
    <unsaturations>0</unsaturations>
  </family_definition>
  <!-- 
    saturated C1-C6 with one alcohol group and 2 halogens
  -->
  <family_definition code="1101">
    <formula>C[1-6] H[1-22] {OH}1 Hal1 Hal1</formula>
    <unsaturations>0</unsaturations>
  </family_definition>
  <!-- 
    saturated C1-C6 with one alcohol group and 3 halogens
  -->
  <family_definition code="1102">
    <formula>C[1-6] H[1-22] {OH}1 Hal1 Hal1 Hal1</formula>
    <unsaturations>0</unsaturations>
  </family_definition>
  <!-- 
    saturated C1-C6 with one alcohol group and 4 halogens
  -->
  <family_definition code="1103">
    <formula>C[1-6] H[1-22] {OH}1 Hal1 Hal1 Hal1 Hal1</formula>
    <unsaturations>0</unsaturations>
  </family_definition>
  <!-- 
    saturated C1-C10 with 2 alcohol groups and 1 halogen
  -->
  <family_definition code="1104">
    <formula>C[1-6] H[1-22] {OH}2 Hal1</formula>
    <unsaturations>0</unsaturations>
  </family_definition>
  <!-- 
    saturated C1-C10 with 2 alcohol groups and 2 halogens
  -->
  <family_definition code="1105">
    <formula>C[1-6] H[1-22] {OH}2 Hal1 Hal1</formula>
    <unsaturations>0</unsaturations>
  </family_definition>
  <!-- 
    saturated C1-C10 with 2 alcohol groups and 3 halogens
  -->
  <family_definition code="1106">
    <formula>C[1-6] H[1-22] {OH}2 Hal1 Hal1 Hal1</formula>
    <unsaturations>0</unsaturations>
  </family_definition>
  <!-- 
    saturated C1-C10 with 2 alcohol groups and 4 halogens
  -->
  <family_definition code="1107">
    <formula>C[1-6] H[1-22] {OH}2 Hal1 Hal1 Hal1 Hal1</formula>
    <unsaturations>0</unsaturations>
  </family_definition>
  <!-- 
    saturated C1-C10 with 1 ketone group and 1 halogen
  -->
  <family_definition code="1108">
    <formula>C[1-7] H[0-20] 'C=O'1 Hal1</formula>
    <unsaturations>0</unsaturations>
    <substructures>
      <substructure substructure_code="KETONE" number="1">
        <atoms>
          <atom type="O"/>
          <atom type="C"/>
          <atom type="C"/>
          <atom type="C"/>
        </atoms>
      </substructure>
    </substructures>
  </family_definition>
  <!-- 
    saturated C1-C10 with 1 ketone group and 2 halogens
  -->
  <family_definition code="1109">
    <formula>C[1-7] H[0-20] 'C=O'1 Hal1 Hal1</formula>
    <unsaturations>0</unsaturations>
    <substructures>
      <substructure substructure_code="KETONE" number="1">
        <atoms>
          <atom type="O"/>
          <atom type="C"/>
          <atom type="C"/>
          <atom type="C"/>
        </atoms>
      </substructure>
    </substructures>
  </family_definition>
  <!-- 
    saturated C1-C10 with 1 ketone group and 3 halogens
  -->
  <family_definition code="1110">
    <formula>C[1-7] H[0-20] 'C=O'1 Hal1 Hal1 Hal1</formula>
    <unsaturations>0</unsaturations>
    <substructures>
      <substructure substructure_code="KETONE" number="1">
        <atoms>
          <atom type="O"/>
          <atom type="C"/>
          <atom type="C"/>
          <atom type="C"/>
        </atoms>
      </substructure>
    </substructures>
  </family_definition>
  <!-- 
    saturated C1-C10 with 1 aldehyde group and 1 halogen
  -->
  <family_definition code="1111">
    <formula>C[0-6] 'CC(=O)H'1 H[0-22]  Hal1</formula>
    <unsaturations>0</unsaturations>
    <substructures>
      <substructure substructure_code="KETONE" number="1">
        <atoms>
          <atom type="O"/>
          <atom type="C"/>
          <atom type="C"/>
          <atom type="H"/>
        </atoms>
      </substructure>
    </substructures>
  </family_definition>
  <!-- 
    saturated C1-C10 with 1 aldehyde group and 2 halogens
  -->
  <family_definition code="1112">
    <formula>C[0-6] 'CC(=O)H'1 H[0-22] Hal1 Hal1</formula>
    <unsaturations>0</unsaturations>
    <substructures>
      <substructure substructure_code="KETONE" number="1">
        <atoms>
          <atom type="O"/>
          <atom type="C"/>
          <atom type="C"/>
          <atom type="H"/>
        </atoms>
      </substructure>
    </substructures>
  </family_definition>
  <!-- 
    saturated C1-C10 with 1 aldehyde group and 3 halogens
  -->
  <family_definition code="1113">
    <formula>C[0-6] 'CC(=O)H'1 H[0-22] Hal1 Hal1 Hal1</formula>
    <unsaturations>0</unsaturations>
    <substructures>
      <substructure substructure_code="KETONE" number="1">
        <atoms>
          <atom type="O"/>
          <atom type="C"/>
          <atom type="C"/>
          <atom type="H"/>
        </atoms>
      </substructure>
    </substructures>
  </family_definition>
  <!-- 
    saturated C2-C10 - 1 ketone + 1 ester
  -->
  <family_definition code="1128">
    <formula>C[0-8] H[0-22] 'C=O'2 {OH0}1</formula>
    <unsaturations>0</unsaturations>
    <substructures>
      <substructure substructure_code="KETONE" number="1">
        <atoms>
          <atom type="O"/>
          <atom type="C"/>
          <atom type="C"/>
          <atom type="C"/>
        </atoms>
      </substructure>
      <substructure substructure_code="ESTER" number="1">
        <atoms>
          <atom type="O"/>
          <atom type="C"/>
          <atom type="O"/>
          <atom type="C"/>
          <atom type="C"/>
        </atoms>
      </substructure>
    </substructures>
  </family_definition>
  <!-- 
    saturated C2-C10 - 1 ether + 1 ester
  -->
  <family_definition code="1130">
    <formula>C[3-9] H[0-24] {OH0}2 'CH0=O'1</formula>
    <unsaturations>0</unsaturations>
    <substructures>
      <substructure substructure_code="ESTER" number="1">
        <atoms>
          <atom type="O"/>
          <atom type="C"/>
          <atom type="O"/>
          <atom type="C"/>
          <atom type="C"/>
        </atoms>
      </substructure>
    </substructures>
  </family_definition>
  <!-- 
    saturated C2-C10 - 1 ester + 1 formate
  -->
  <family_definition code="1147">
    <formula>C[0-8] H[0-24] 'CH0=O'1 {OH0}1 'OC(=O)H'1</formula>
    <unsaturations>0</unsaturations>
    <substructures>
      <substructure substructure_code="ESTER" number="2" repetition="xor">
        <atoms>
          <atom type="O"/>
          <atom type="C"/>
          <atom type="O"/>
          <atom type="C"/>
          <atom type="CorH"/>
        </atoms>
      </substructure>
    </substructures>
  </family_definition>
</family_definitions>

