<?xml version='1.0' encoding='UTF-8'?>
<!DOCTYPE family_definitions SYSTEM "family_definitions.dtd">
<family_definitions version="1.0">
  <!-- 
    benzene test family:
     - for C5 NoP1 H2 Hal2 Hal1: 432
     - for C5 N1 {CH3}2 Hal2 Hal1 : 216
     - for C6 SB1 SB1 SB1 SB1 SB1 SB1 : 4291
     - for C6 ^SB1 ^SB1 ^SB1 ^SB1 ^SB1 ^SB1 : 60
  -->
  <family_definition code="test_benzene">
    <formula>C6 ^SB1 ^SB1 ^SB1 ^SB1 ^SB1 ^SB1</formula>
    <double_bonds>3</double_bonds>
    <substructures>
      <substructure substructure_code="BENZENE" number="1">
        <atoms>
          <atom type="*"/>
          <atom type="C"/>
          <atom type="C"/>
          <atom type="C"/>
          <atom type="C"/>
          <atom type="C"/>
        </atoms>
      </substructure>
    </substructures>
  </family_definition>
  <family_definition code="double_bond">
    <formula>C[2-5]H[0-20]</formula>
    <double_bonds>1</double_bonds>
    <unsaturations>1</unsaturations>
  </family_definition>
  <family_definition code="double_bond_halo">
    <formula>C[2-3]H[0-12]F[0-12]Br[0-12]</formula>
    <double_bonds>1</double_bonds>
    <unsaturations>1</unsaturations>
  </family_definition>
  <family_definition code="cycles">
    <formula>C6H[0-20]F1Br1</formula>
    <cycles>1</cycles>
    <unsaturations>1</unsaturations>
  </family_definition>
</family_definitions>

